日期,星期,当日技术核心任务,当日运动安排,当日饮食核心要求,当日作息锚点
2026.3.16,周一,1. 完成 WinDbg + 符号服务器环境搭建2. 学习 C++ 内存模型与对象生命周期核心知识点3. 工作中落地：用新搭建的环境分析 1 个现有项目 Dump 文件,35 分钟椭圆机低强度有氧，心率控制在最大心率 60-70%，运动前后各 5 分钟拉伸,1. 每日总热量 1800-2000 大卡2. 早餐：燕麦 50g + 鸡蛋 2 个 + 纯牛奶 250ml3. 午餐：杂粮饭 100g + 鸡胸肉 150g + 绿叶菜 200g4. 晚餐：红薯 100g + 鱼虾 120g + 凉拌菜 150g5. 全天饮水 2.5L 以上,1. 6:30 起床，23:00 准时入睡2. 7:00-8:30 黄金深度学习时间3. 19:00-20:30 固定运动时间4. 20:30-22:30 实战学习时间
2026.3.17,周二,1. 学习 CSAPP 第一章核心内容，完成 Lab 环境准备2. 复现并修复 1 个空指针 / 野指针崩溃案例，输出分析报告3. 工作中落地：用 C++ 防崩溃规范优化现有项目 1 个模块,30 分钟自重力量训练：靠墙静蹲 3 组 ×60 秒、跪姿俯卧撑 3 组 ×12 次、臀桥 3 组 ×15 次、平板支撑 3 组 ×30 秒，组间休息 60 秒,同周一标准，保证全天蛋白质摄入≥180g，戒掉含糖饮料、精制碳水、油炸食品,同周一作息锚点，午休 20-30 分钟，不超过 40 分钟
2026.3.18,周三,1. 学习 CPU 缓存架构、伪共享、分支预测核心知识点2. 学习 Visual Studio Profiler 基础使用3. 工作中落地：用 Profiler 定位现有项目的 CPU 性能瓶颈,35 分钟跑步机坡度快走（坡度 6，速度 5.5km/h），心率控制在最大心率 60-70%，运动前后拉伸,同前标准，晚餐碳水减半，全天饮水不低于 2.5L,同周一作息锚点，每工作 1 小时起身活动 5 分钟
2026.3.19,周四,1. 学习 C++ 多线程内存序、并发编程基础2. 学习 Windows SEH/VEH 异常机制核心原理3. 复现并修复 1 个多线程相关的崩溃案例,30 分钟自重力量训练，动作同周二，每组次数提升 20%，增加 1 组侧平板支撑,同前标准，保证优质蛋白质摄入，睡前 3 小时不进食,同周一作息锚点，睡前 5 分钟完成当日复盘
2026.3.20,周五,1. 学习 NVIDIA GPU 基础架构、SM 单元、Warp 调度核心知识点2. 完成 Nsight Graphics 环境搭建，学习基础帧抓取操作3. 工作中落地：用 Nsight 抓取项目一帧，分析基础渲染管线,35 分钟固定自行车低强度有氧，心率控制在最大心率 60-70%，运动前后拉伸,同前标准，不额外加餐，不饮酒,同周一作息锚点，完成本周前 4 天内容复盘
2026.3.21,周六,1. 学习《深度探索 C++ 对象模型》核心章节2. 整理本周 5 个崩溃案例，完成完整分析报告3. 完成 CSAPP 第一个 Lab,40 分钟椭圆机有氧 + 20 分钟核心训练（平板支撑、卷腹、俄罗斯转体），总时长 60 分钟,中午可安排 1 次欺骗餐，晚餐回归清淡饮食，全天总热量不超过 2500 大卡,1. 7:30 起床，不熬夜2. 9:00-12:00 系统深度学习3. 14:00-16:00 固定运动时间4. 20:00-22:00 周度复盘
2026.3.22,周日,1. 轻度技术阅读，不强制高强度学习2. 完成本周全内容复盘，调整下周计划3. 准备下周学习资料与环境,完全休息日，可户外慢走 30 分钟，不做高强度运动,正常清淡饮食，不超标，为下周训练做准备,1. 可睡懒觉，不晚于 9:00 起床2. 22:00 前完成下周计划制定3. 23:00 前入睡，保证充足休息
